<?xml version="1.0"?>
<stage xmlns="http://cerberus.compsat.org" xmlns:xsi="http://www.w3.org/2001/XMLSchema-instance" xsi:schemaLocation="http://cerberus.compsat.org stage.xsd">
    <welcome_msg></welcome_msg>
    <choose score="1" id="1">
        <q>f</q>
        <choice answer="true"></choice>
        <choice></choice>
        <choice></choice>
        <choice></choice>
    </choose>
    <choose score="1" id="2">
        <q>new question</q>
        <choice answer="true"></choice>
        <choice></choice>
        <choice></choice>
        <choice></choice>
    </choose>
</stage>
