<?xml version="1.0"?>
<stage xmlns="http://cerberus.compsat.org" xmlns:xsi="http://www.w3.org/2001/XMLSchema-instance" xsi:schemaLocation="http://cerberus.compsat.org stage.xsd" time_limit="5">
    <welcome_msg>You guys are screwed</welcome_msg>
    <choose multiple="true" score="10" id="1">
        <q>What is a man?</q>
        <choice answer="true">A miserable pile of bullshit</choice>
        <choice>huh?</choice>
        <choice>FEDORA MAN</choice>
        <choice answer="true">a sentient being</choice>
    </choose>
    <choose multiple="true" score="8" id="2">
        <q>Why am i the only one testing?</q>
        <choice>because no one wants to</choice>
        <choice answer="true">not enough laptop</choice>
        <choice>it's my birthday</choice>
        <choice answer="true">they want to</choice>
    </choose>
    <choose multiple="true" score="10" id="3">
        <q>What is a man?</q>
        <choice answer="true">A miserable pile of bullshit</choice>
        <choice>huh?</choice>
        <choice>FEDORA MAN</choice>
        <choice answer="true">a sentient being</choice>
    </choose>
    <choose multiple="true" score="8" id="4">
        <q>Why am i the only one testing?</q>
        <choice>because no one wants to</choice>
        <choice answer="true">not enough laptop</choice>
        <choice>it's my birthday</choice>
        <choice answer="true">they want to</choice>
    </choose>
</stage>
